"site.id","site.name","handle","latitude","longitude","elevation","dataset.id","dataset.type","source","publication","description","doi"
23938,"Lago di Massaciuccoli","MASSAMSC",43.83784,10.3308,0,52240,"pollen","European Pollen Database","Mariotti Lippi, M., M.A. Guido, B.I. Menozzi, C. Bellini, and C.A. Montanari. 2007. The Massaciuccoli Holocene pollen sequense and the vegetation history of the coastal plains by the Mar Ligure (Tuscany and Liguria, Italy). Vegetation History and Archaeobotany 16:269-277.;
Menozzi, B.I., A. Fichera, M.A. Guido, M. Mariotti Lippi, C.A. Montanari, G. Zanchetta, F.P. Bonadonna, and F. Garbari. 2003. Lineamenti paleoambientali del bacico del Lago di Massaciuccoli (Toscana Nord-occidentale, Italia). Società Toscana di Scienze Naturali 109(Serie B):177-187.","Lake originated as a retrodunal basin after the last sea transgression. Seaward it is bordered by a coastal sandy belt and eastward it is surrounded by Mesozoic limestone hills and alluvial fans of glacial origin. There are four inlets and one outlet. The vegetation around the lake is dominated by Phragmites australis and Cyperaceae. The surrounding hills are covered with meso-Mediterranean mixed deciduous and evergreen Quercus forests","10.21233/G00C-1B61"
23945,"Füramooser Ried","FURAMOOS",47.990985,9.887395,662,41617,"pollen","European Pollen Database","Müller, U.C. 2001. Die Vegetations- und Klimaentwicklung im jüngeren Quartär anhand ausgewählter Profile aus dem südwestdeutschen Alpenvorland. Tübinger Geowissenschaftliche Arbeiten D7. Tübingen.;
Müller, U.C., J. Pross, and E. Bibus. 2003. Vegetation response to rapid climate change in Central Europe during the past 140,000 yr based on evidence from Füramoos pollen record. Quaternary Research 59:235-245.","Between two moraine ridges. Physiography: Basin. Vegetation formation: Alpine foreland.","10.21233/s56r-0474"
23956,"Bad Urach","BADUR",48.48328,9.40457,466,41643,"pollen","European Pollen Database","Rösch, M. 1993. Quartärbotanische Untersuchung eines frühholozänen Torfes von Bad Urach (Schwäbische Alb). Pages 369-376 in C. Brombacher, S. Jacomet, and J.N. Haas, editors. Festschrift Heinrich Zoller. Dissertationes Botanicae 196. Cramer, Berlin Stuttgart.","Former construction site for a storage hall with peat in the subsoil","10.21233/qq12-pr84"
23958,"La Molina mire","MOLINAES",43.381111,-6.327222,650,41646,"pollen","European Pollen Database","López-Merino, L., A. Martínez-Cortizas, and J.A. López-Sáez. 2011. Human-induced changes on wetlands: a study case from NW Iberia. Quaternary Science Reviews 30:2745-2754.","Mire. Physiography: Ridge. Surrounding vegetation: Oak, beech, birch and chestnut-tree.","10.21233/889v-rw31"
23959,"Tyre","TYR1",33.278056,35.203056,3,41648,"pollen","European Pollen Database","Marriner, N., and C. Morhange. 2005. Under the city centre, the ancient harbour. Tyre and Sidon: heritages to preserve. Journal of Cultural Heritage 6:183-189.;
Marriner, N., J.L. de Beaulieu, and C. Morhange. 2004. Note on the Vegetation Landscapes of Sidon and Tyre during Antiquity. Archaeology & History in Lebanon 19:85-91.;
Marriner, N., J.L. de Beaulieu, and C. Morhange. 2006. Marriner, N., and C. Morhange. 2006. Geoarchaeological evidence for dredging in Tyre's ancient harbour, Levant. Quaternary Research. 65.",,"10.21233/rfft-1936"
23962,"Sonnenberger Moor","SONENBGM",51.766315,10.513539999999999,780,41653,"pollen","European Pollen Database","Willutzki, H. 1962. Zur Waldgeschichte und Vermoorung sowie über Rekurrenzflächen im Oberharz. Nova Acta Leopoldina N.F. 25 (160):1-52.","Peat bog. Physiography: saddle bog.","10.21233/e7j2-b618"
23963,"El Pirulejo","PIRULEJO",37.438889,-4.195,660,41655,"pollen","European Pollen Database","López-Sáez, J.A., L. López-Merino, and S. Pérez-Díaz. 2008. Historia de la vegetación: una aproximación arqueopalinológica [History of the vegetation: an archeopalynological approach]. M.H.M. Priego de Córdoba. Antiqvitas 20:41-47.","Archaeological site. Physiography: Cave. Surounging vegetation: urban area.","10.21233/mhe0-za87"
23964,"Patateros bog","PATATERO",39.597222,-4.674167,700,41657,"pollen","European Pollen Database","Dorado-Valiño, M., J.A. López-Sáez, and E. García-Gómez. 2014. Contribution to the European Pollen Database. 21. Patateros, Toledo Mountains (central Spain). Grana 53(2):171-173.","Peat bog. Physiography: Valley. Surrounding vegetation: Planted Pinus forest. Vegetation formation: Mediterranean area Quercus pyrenaica.","10.21233/22yh-z232"
23965,"Gartower Forst","HEUWEG2",53.01739,11.415299999999998,33,41661,"pollen","European Pollen Database","Lesemann, B. 1969. Pollenanalytische Untersuchungen zur Vegetationsgeschichte des Hannoverschen Wendlandes. Flora 158:480-519.","Bog. Physiography: Depression. Surrounding vegetation: Pine forest.","10.21233/fzzq-rh73"
23966,"Siemen","SIEMEN2",53.04599,11.2336,15,41664,"pollen","European Pollen Database","Lesemann, B. 1969. Pollenanalytische Untersuchungen zur Vegetationsgeschichte des Hannoverschen Wendlandes. Flora 158:480-519.","Swamp. Physiography: Plain. Surrounding vegetation: Cultivated fields and forest.","10.21233/nm52-by22"
23967,"Laase","LAASE2",53.063355,11.29615,17,41667,"pollen","European Pollen Database","Lesemann, B. 1969. Pollenanalytische Untersuchungen zur Vegetationsgeschichte des Hannoverschen Wendlandes. Flora 158:480-519.","Swamp. Physiography: Floodplain of the Elbe. Surrounding vegetation: Cultivated fields and forest.","10.21233/hewe-xt16"
23968,"Valdeyernos bog","VALDEYER",39.441111,-4.096389,850,41669,"pollen","European Pollen Database","Dorado-Valiño, M., J.A. López-Sáez, and E. García-Gómez. 2014. Contributions to the European Pollen Database. 26. Valdeyernos, Toledo Mountains (central Spain). Grana 53(4):315-317.","Peat bog. Physiography: Valley of Sierra de Torneros. Surrounding vegetation: Deciduous oak (Q. pyrenaica & faginea). Vegetation formation: Mediterranean.","10.21233/69nc-5r65"
23969,"El Payo","ELPAYO",40.253333,-6.771111,984,41671,"pollen","European Pollen Database","Abel-Schaad, D., A.M. Hernández-Carretero, J.A. López-Sáez, F.J. Pulido-Díaz, L. López-Merino, and A. Martínez-Cortizas. 2009. Evolución de la vegetación en la Sierra de Gata (Cáceres-Salamanca, España) durante el Holoceno reciente. Implicaciones biogeográficas. Revista Española de Micropaleontologia 41(1-2):91-105.","Mire. Physiography: Valley. Surrounding vegetation: Pinus sylv. shrub & Echinosparum brush.","10.21233/yp1t-8s22"
23970,"Turbera de La Panera Cabras","PANERA",40.165833,-5.758056,1648,41673,"pollen","European Pollen Database","Abel-Schaad, D., A.M. Hernández-Carretero, L. López-Merino, F.J. Pulido-Díaz, and J.A. López-Sáez. 2009. Cabras y quemorros: tres siglos de cambios en el paisaje de la vertiente extremeña de la Sierra de Gredos. Revista de Estudios Extremeños LXV(1):449-478.","Peat bog. Physiography: Mountain. Surrounding vegetation: Herb.","10.21233/vyyh-qf19"
24031,"Kolbermoor","KOLBER1",47.85652,12.06662,470,41740,"pollen","European Pollen Database","Beug, H.J. 1976. Die spätglaziale und frühpostglaziale Vegetationsgeschichte im Gebiet des ehemaligen Rosenheimer Sees (Oberbayern). Botansche Jahrbücher für Systematik, Pflanzengeschichte und Pflanzengeographie 95(3):373-400.","Mire and clay pit rounded by villages. Physiography: Late Glacial lake in open valley. Surrounding vegetation: Cultivated fields and little forests.","10.21233/086x-tm08"
24032,"Peña Negra","PENANEGR",40.334722,-5.792222,1258,41746,"pollen","European Pollen Database","Abel-Schaad, D., and J.A. López-Sáez. 2013. Vegetation changes in relation to fire history and human activities at the Peña Negra mire (Bejar Range, Iberian Central Mountain Sysrem, Spain) during the past 4,000 years. Vegetation History and Archaeobotany 22(3):199-214.","Mire. Physiography: Montain in Cáceres area. Surrounding vegetation: Cultivated fields and oak forest. Vegetation formation: Supra/meso mediterranean oak forest.","10.21233/rd01-0v56"
24036,"Puerto de Serranillos","SERRANIL",40.307222,-4.934167,1700,41753,"pollen","European Pollen Database","López-Merino, L., J.A. López-Sáez, S. Pérez-Díaz, and J.S. Carrión. 2009. 2000 years of pastoralism and fire shaping high-altitude vegetation of Sierra de Gredos in central Spain. Review of Palaeobotany and Palynology 158:42-51.","Mire. Physiography: Basin with granitic bedrock mountain. Surrounding vegetation: Grassland with patches of Jun.CystusPinu.","10.21233/rarx-fe28"
24037,"PRD-4","PRD4",42.533333,-8.516667,260,41755,"pollen","European Pollen Database","López-Merino, L., N. Silva-Sánchez, J. Kaal, J.A. López-Sáez, and A. Martínez-Cortizas. 2012. Post-disturbance vegetation dynamics during the Late Pleistocene and Holocene : An example from NW Iberia. Global and Planetary Change 92- 93:58-70.","Colluvial soil monolith. Physiography: Depression in valley. Surrounding vegetation: Pinus pinaster Quercus robur Pteridium. Vegetation formation: Atlantic/Eurosiberian region.","10.21233/cg7r-v764"
24038,"Posidonia Lligat","LLIGAT",42.292222,3.291111,-3,41758,"pollen","European Pollen Database","López-Sáez, J.A., L. López-Merino, M.A. Mateo, O. Serrano, S. Pérez-Díaz, and L. Serrano. 2009. Palaeoecological potential of the marine organic deposits of Posidonia oceanica: A case study in the NE Iberian Peninsula. Palaeogeography, Palaeoclimatology, Palaeoecology 271:215-224.","Bay. Physiography: Mediterranean coastal bay.","10.21233/x8p5-xp81"
24039,"Culazón","CULAZON",43.232778,-4.489167,592,41760,"pollen","European Pollen Database","López-Sáez, J.A., D. Abel-Schaad, F. Alba-Sánchez, R. González-Pellejero, M. Frochoso, and F. Allende. 2013. Contribution to the European Pollen Database. 20. Culazón, Cantabrian Mountains (northern Spain). Grana 52(4):316-318.","Raised bog. Physiography: Lamasón valley. Surrounding vegetation: Meadows and pastures.","10.21233/eakm-1a87"
24041,"Lake Skaidejavri","SKAIDJVR",70.05160000000001,27.847610000000003,183,41764,"pollen","European Pollen Database","Seppä, H. 1996. Post-glacial dynamics of vegetation and tree-lines in the far north of Fennoscandia. Fennia 174:1-96.","Medium size lake. Physiography: Rolling rockland. Surrounding vegetation: Sparse mountain birch forest.","10.21233/fka8-9069"
24042,"Lake Kvarnträsk","KVARNTRA",60.34577,19.97168,14,41766,"pollen","European Pollen Database","Sarmaja-Korjonen, K., Y. Vasari, and C.A. Hæggström. 1991. Taxus baccata and influence of Iron Age man on the vegetation in Åland, SW Finland. Annales Botanici Fennici 28:143-159. https://www.jstor.org/stable/23725403.",,"10.21233/fds1-dt10"
24111,"Charco da Candieira","CANDIEIR",40.341667,-7.576389,1409,41909,"pollen","European Pollen Database","van der Knaap, W.O., and J.F.N. van Leeuwen. 1984. Holocene vegetation, human impact, and climatic change in the Serra da Estrela, Portugal. Dissertationes Botanicae 234:497-535.;
van der Knaap, W.O., and J.F.N. van Leeuwen. 1995. Holocene vegetation succession and degradation as responses to climatic change and human activity in the Serra da Estrela, Portugal. Review of Palaeobotany and Palynology 89:153-211.;
van der Knaap, W.O., and J.F.N. van Leeuwen. 1997. Late-Glacial and early-Holocene vegetation succession, altitudinal vegetation zonation, and climatic change in the Serra da Estrela, Portugal. Review of Palaeobotany and Palynology 97:239-285.","Pond 100 m across, adjacent peaty area. Physiography: Base of hanging valley, granite, glaciated. Surrounding vegetation: Nardus, Ericaceae, Cytisus, Genista, Halimium.","10.21233/6tgg-3a45"
24112,"Lagoa Comprida 2","LAGOA_CO",40.362778,-7.636111,1650,41911,"pollen","European Pollen Database","Janssen, C.R., and R.E. Wolderingh. 1981. A preliminary radiocarbon dated pollen sequence from the Serra da estrela, Portugal. Finisterra 16(32):299-309..;
Moe, D., and W.O. van der Knaap. 1990. Transhumance in mountain areas: additional interpretation of three pollen diagrams from Norway, Portugal and Switzerland. Pact 31, Impact of prehistoric and medieval man on the vegetation: Man at the forest limit. Report of the meeting held at Ravello, December 9 and 10. 1990. Pact Network, Palaeoecology. Pact Belgium, Rixensiart..;
van der Brink, L.M., and C.R. Janssen. 1985. The effect of human activities during cultural phases on the development of montane vegetation in the Serra da Estrela, Portugal. Review of Palaeobotany and Palynology 44:193-215..","Peats with pond. Physiography: Small depression. Surrounding vegetation: Heathland, Juniperus, Erica, Calluna.","10.21233/xfh1-6085"
24124,"Lake Saloio","SALOIO",39.613333,-9.015833,70,41924,"pollen","European Pollen Database","Gomes, S.D. 2011. Contributions to the European Pollen Database. 13. Lake Saloio (Nazaré, western Portugal). Grana 50(3):228-231.","Lake. Physiography: Groundwaterfed interdunal lake. Surrounding vegetation: Planted Pinus forest. Vegetation formation: Mediterranean.","10.21233/3tk9-q985"
24125,"Lagoa Travessa II","TRAVESS2",38.304444,-8.7725,3,41926,"pollen","European Pollen Database","Mateus, J.E. 1992. Holocene and present-day ecosystems of the Carvalhal region, South-west Portugal. Doctoral dissertation. University of Utrecht, Utrecht, The Netherlands.","Semi-terrestrial lagoon fen. Physiography: Perimarine interdunal lagoon. Surrounding vegetation: Halimietalia commutati scrubs with pine.","10.21233/zdyp-3t68"
24125,"Lagoa Travessa II","TRAVESS1",38.304444,-8.7725,3,41928,"pollen","European Pollen Database","Mateus, J.E. 1992. Holocene and present-day ecosystems of the Carvalhal region, South-west Portugal. Doctoral dissertation. University of Utrecht, Utrecht, The Netherlands.","Semi-terrestrial lagoon fen. Physiography: Perimarine interdunal lagoon. Surrounding vegetation: Halimietalia commutati scrubs with pine.","10.21233/dcqy-3516"
24147,"Jammertal","JAMEREEM",48.09901,9.7276,578,42200,"pollen","European Pollen Database","Klotz, S., U.C. Müller, V. Mosbrugger, J.L. de Beaulieu, and M. Reille. 2004. Eemian to early Würmian climate dynamics: history and pattern of changes in Central Europe. Palaeogeography, Palaeoclimatology, Palaeoecology 211(1-2):107-126.;
Müller, U.C. 1997. Pollenanalytische Untersuchungen an einer kontinuierlichen Folge vom Riß-Spätglazial bis zum Mittleren Würm aus dem Altmoränengebiet des Jammertals bei Biberach a.d. Riß/Oberschwaben. Master's thesis. Universität Tübingen. Notes: Unveröffentlichte Diplomarbeit;
Müller, U.C. 2000. A Late-Pleistocene pollen sequence from the Jammertal, south-western Germany with particular reference to location and altitude as factors determining Eemian forest composition. Vegetation History and Archaeobotany 9:125-131.;
Müller, U.C. 2001. Die Vegetations- und Klimaentwicklung im jüngeren Quartär anhand ausgewählter Profile aus dem südwestdeutschen Alpenvorland. Tübinger Geowissenschaftliche Arbeiten D7. Tübingen.;
Müller, U.C., S. Klotz, M.A. Geyh, J. Pross, and G.C. Bond. 2005. Cyclic climate fluctuations during the last interglacial in central Europe. Geology 33(6):449-452.","Peat bog. Physiography: Subglacial basin bordered by moraines. Vegetation formation: Alpine foreland.","10.21233/247g-bm06"
24173,"Gomishan","TMGM2",37.151667,54.056667,-26,42417,"pollen","European Pollen Database","Leroy, S.A.G., A.A. Kakroodi, S. Kroonenberg, H. Lahijani, H. Alimohammadian, and A. Nigarov. 2013. Holocene vegetation hitory and sea level changes in the SE corner of the Caspian Sea: relevance to SW Asia climate. Quaternary Science Reviews 70:28-47.","Salt marsh. Physiography: Dried lagoon, endorheing lake. Surrounding vegetation: Cultivated area.","10.21233/0wn3-0048"
24174,"Lake Urmia II","BH2",37.793611,45.375833,1265,42419,"pollen","European Pollen Database","Djamali, M., J.L. de Beaulieu, M. Shah-hosseini, V. Andrieu-Ponel, P. Ponel, A. Amini, H. Akhani, S.A.G. Leroy, L. Stevens, H. Lahijani, and S. Brewer. 2008. A late Pleistocene long pollen record from Lake Urmia, NW Iran. Quaternary Research 69:413-420.","Hyppersaline (>200g/l) lake. Physiography: Subsiding tectonic basin. Surrounding vegetation: Artemisia steppe (A. fragrans). Vegetation formation: Steppe.","10.21233/fgc5-5d92"
24175,"Lake Almalou","ALMALOU3",37.665278,46.631944,2410,42421,"pollen","European Pollen Database","Djamali, M., J.L. de Beaulieu, V. Andrieu-Ponel, M. Berberian, N.F. Miller, E. Gandouin, H. Lahijani, M. Shah-hosseini, P. Ponel, M. Salimian, and F. Guiter. 2009. A late Holocene pollen record from Lake Almalou in NW Iran: evidence for changing land-use in relation to some historical events during the last 3700 years. Journal of Archaeological Science 36:1363-1375.;
Djamali, M., N.F. Miller, E. Ramezani, V. Andrieu-Ponel, J.L. de Beaulieu, M. Berberian, F. Guibal, H.A.K. Lahijani, R. Lak, and P. Ponel. 2010. Notes on Arboricultural and Agricultural Practices in Ancient Iran based on New Pollen Evidence. Paléorient 36(2):175-188. Notes: CNRS EDITIONS","Peat bog. Physiography: Volcanic crater wetland complex. Surrounding vegetation: Cultivated fields.","10.21233/298g-zr75"
24176,"Lake Parishan","PARISLP3",29.495425,51.82912,823,42448,"pollen","European Pollen Database","Djamali, M., M.D. Jones, J. Migliore, S. Balatti, M. Fader, D.A. Contreras, S. Gondet, Z. Hosseini, H.A.K. Lahijani, A. Naderi-Beni, L.S. Shumilovskikh, M. Tengberg, and L. Weeks. 2015. Olive cultivation in the heart of the Persian Achaemenid Empire: new insights into agricultural practices and environmental changes reflected in a late Holocene pollen record from Lake Parishan, SW Iran. Vegetation History and Archaeobotany. [DOI: DOI: 10.1007/s00334-015-0545-8.];
Jones, M.D., M. Djamali, J. Holmes, L. Weeks, M.J. Leng, A. Lashkari, K. Alamdari, D. Noorcollahi, L. Thomas, and S.E. Metcalfe. 2015. Human impact on the hydroenvironment of lake Parishan, SW, Iran, through the late Holocene. The Holocene. [DOI: DOI: 10.1177/0959683615594242.]","Lake. Physiography: Basin. Surrounding vegetation: Pasture and cultivated lands.","10.21233/n19t-1361"
24179,"Maharlou Lake","MAHARLOU",29.477222,52.759722,1455,42539,"pollen","European Pollen Database","Djamali, M., J.L. de Beaulieu, N.F. Miller, V. Andrieu-Ponel, P. Ponel, R. Lak, N. Sadeddin, H. Akhani, and H. Fazeli. 2009. Vegetation history of the SE section of the Zagros Mountains during the last five millennia; a pollen record from the Maharlou Lake, Fars Province, Iran. Vegetation History and Archaeobotany 18:123-136.;
Djamali, M., N.F. Miller, E. Ramezani, V. Andrieu-Ponel, J.L. de Beaulieu, M. Berberian, F. Guibal, H.A.K. Lahijani, R. Lak, and P. Ponel. 2010. Notes on Arboricultural and Agricultural Practices in Ancient Iran based on New Pollen Evidence. Paléorient 36(2):175-188. Notes: CNRS EDITIONS","Hypersaline lake. Physiography: Closed basin. Surrounding vegetation: Xeromorphic dwarf-shrub cultivated lands. Vegetation formation: Pistacia-Amygdalus open scrub.","10.21233/1bdv-yc11"
24181,"Bruchbergmoor","BRUCHBG1",51.779185,10.493884999999999,910,42542,"pollen","European Pollen Database","Beug, H.J., I. Henrion, and A. Schmüser. 1999. Landschaftsgeschichte im Hochharz - die Entwicklung der Wälder und Moore seit dem Ende der letzten Eiszeit. Gesellschaft zur Förderung des Nationalparks Harz e.V., Clausthal-Zellerfeld.","Peat bog crest.","10.21233/234z-6f61"
24182,"Auf dem Acker","BRUCHBG2",51.749044999999995,10.4391,825,42544,"pollen","European Pollen Database","Beug, H.J., I. Henrion, and A. Schmüser. 1999. Landschaftsgeschichte im Hochharz - die Entwicklung der Wälder und Moore seit dem Ende der letzten Eiszeit. Gesellschaft zur Förderung des Nationalparks Harz e.V., Clausthal-Zellerfeld.;
Willutzki, H. 1962. Zur Waldgeschichte und Vermoorung sowie über Rekurrenzflächen im Oberharz. Nova Acta Leopoldina N.F. 25 (160):1-52.","Peat bog crest.","10.21233/ssa1-mx12"
24186,"Großvillars Alter See","OVSA",49.042739999999995,8.75934,207,42555,"pollen","European Pollen Database","Rösch, M. 2005. Zur Vegetationsgeschichte des südlichen Kraichgaus - Botanische Untersuchungen bei Großvillars, Gemeinde Oberderdingen, Landkreis Karlsruhe. Fundberichte aus Baden-Württemberg 28(1):839-870.","Palaeolake","10.21233/jwt1-1r97"
24186,"Großvillars Alter See","OVSC1",49.042739999999995,8.75934,207,42557,"pollen","European Pollen Database","Rösch, M. 2005. Zur Vegetationsgeschichte des südlichen Kraichgaus - Botanische Untersuchungen bei Großvillars, Gemeinde Oberderdingen, Landkreis Karlsruhe. Fundberichte aus Baden-Württemberg 28(1):839-870.","Palaeolake","10.21233/bzbr-4h48"
24188,"Altar Lough","ALTAR",55.018675,-8.38863,31,42563,"pollen","European Pollen Database","Fossitt, J.A. 1994. Late-glacial and Holocene vegetation history of western Donegal, Ireland. Biology and Environment: Proceedings of the Royal Irish Academy 94B(1):1-31.","Small lake with catchment dominated by blanket peat in which pine stumps are common. Scattered shrub of Salix cinerea, Juniperus communis, Ulex europaeus, and Ilex aquifolium. Arctostaphylos uva-ursi is abundant on steeper slopes. Isoëtes lacutris, Eleogiton fluitans, Potamogeton and Lobelia dortmanna grow in the lake. Eriocaulon aquaticum forms mono-swards in shallow water. ","10.21233/59ks-w850"
24189,"Bruckmisse","BRM3",48.731195,8.644115,666,42568,"pollen","European Pollen Database","Rösch, M. 2009. Botanical evidence for prehistoric and medieval land use in Black Forest. Pages 335-343 in J. Klapste and P. Sommer, editors. Medieval Rural Settlement in Marginal Landscapes. Ruralia VII. Brepols, Turnhout.","Small mire.","10.21233/2kj1-jp45"
24189,"Bruckmisse","BRM1",48.731195,8.644115,666,42566,"pollen","European Pollen Database","Rösch, M. 2009. Botanical evidence for prehistoric and medieval land use in Black Forest. Pages 335-343 in J. Klapste and P. Sommer, editors. Medieval Rural Settlement in Marginal Landscapes. Ruralia VII. Brepols, Turnhout.;
Rösch, M., H. Volk, and G. Wieland. 2005. Frühe Waldnutzung und das Alter des Naturwaldes im Schwarzwald - neue vegetationsgeschichtliche Untersuchungen in den Missenmooren des Nordschwarzwaldes. AFZ Der Wald 12/2005:636-638.","Small mire.","10.21233/8djx-f954"
24189,"Bruckmisse","BRM4",48.731195,8.644115,666,42570,"pollen","European Pollen Database","Rösch, M. 2009. Botanical evidence for prehistoric and medieval land use in Black Forest. Pages 335-343 in J. Klapste and P. Sommer, editors. Medieval Rural Settlement in Marginal Landscapes. Ruralia VII. Brepols, Turnhout.","Small mire.","10.21233/q95g-2x92"
24234,"Hornstaad-Hörnle","HOB",47.694645,9.006615,385,42649,"pollen","European Pollen Database","Rösch, M. 1992. Human impact as registered in the pollen record: some results from the western Lake Constance region, Southern Germany. Vegetation History and Archaeobotany 1:101-109.;
Rösch, M. 1993. Prehistoric land use as recorded in a lake-shore core at Lake Constance. Vegetation History and Archaeobotany 2:213-232.;
Rösch, M. 1997. Holocene sediment accumulation in the shallow water zone of Lower Lake Constance. Archiv für Hydrobiologie Supplement 107(4):541-562.","Lake. Physiography: Main finger lake of the Rhine glacier. Surrounding vegetation: Small wetland forest belt, field meadows. Vegetation formation: Deciduous forest (beech forest).","10.21233/82zt-4874"
24235,"Gaienhofen","GAI1",47.67799,8.97433,408,42652,"pollen","European Pollen Database","Rösch, M., and W. Ostendorf. 1988. Pollenanalytische, torf- und sedimentpetrographische Untersuchungen an einen telmatischen Profil vom Bodensee-Ufer bei Gaienhofen. Telma 18:373-395.","Lake. Physiography: Shore region of Lake Constance.","10.21233/aryj-gv14"
24240,"Glaswaldsee","GWA1",48.42584,8.26188,839,42668,"pollen","European Pollen Database","Rösch, M. 2009. Botanical evidence for prehistoric and medieval land use in Black Forest. Pages 335-343 in J. Klapste and P. Sommer, editors. Medieval Rural Settlement in Marginal Landscapes. Ruralia VII. Brepols, Turnhout.;
Rösch, M. 2009. Zur vorgeschichtlichen Besiedlung und Landnutzung im nördlichen Schwarzwald aufgrund vegetationsgeschichtlicher Untersuchungen in zwei Karseen. Mitteilungen des Vereins für Forstliche Standortskunde und Forstpflanzenzüchtung 46:69-82.","Lake. Physiography: Red Triassic bedrock (sandstone) cirque. Surrounding vegetation: Black Forest.","10.21233/wd4p-9864"
24241,"Wilder See am Ruhestein","WILA",48.56961,8.2395,910,42671,"pollen","European Pollen Database","Rösch, M. 2009. Botanical evidence for prehistoric and medieval land use in Black Forest. Pages 335-343 in J. Klapste and P. Sommer, editors. Medieval Rural Settlement in Marginal Landscapes. Ruralia VII. Brepols, Turnhout.;
Rösch, M. 2009. Zur vorgeschichtlichen Besiedlung und Landnutzung im nördlichen Schwarzwald aufgrund vegetationsgeschichtlicher Untersuchungen in zwei Karseen. Mitteilungen des Vereins für Forstliche Standortskunde und Forstpflanzenzüchtung 46:69-82.","Lake. Physiography: Cirque. Surrounding vegetation: ""Black Forest"".","10.21233/w0c2-k512"
24242,"Huzenbacher See","HUZ1",48.574655,8.348514999999999,747,42673,"pollen","European Pollen Database","Rösch, M., and G. Tserendorj. 2011. Der Nordschwarzwald -  früher besiedelt als gedacht? Pollenprofile belegen ausgedehnte vorgeschichtliche Besiedlung und Landnutzung. Denkmalpflege in Baden-Württemberg 40(2):66-73.;
Rösch, M., and G. Tserendorj. 2011. Florengeschichtliche Beobachtungen im Nordschwarzwald (Südwestdeutschland). Hercynia N. F. 44:53-71.","Lake","10.21233/s6my-6052"
