"site.id","site.name","handle","latitude","longitude","elevation","dataset.id","dataset.type","source","publication","description","doi"
3427,"Marais de la Perge","SO4",45.3975,-1.010278,2,4440,"pollen","European Pollen Database","Diot, M.F., and J.P. Tastet. 1995. Paleo-environnements Holocenes et limites chrono-climatiques enregistres dans un marais estuarien de la Gironde (France). Quaternaire 6(2):63-75.","Marsh La Perge. Physiography: atlantic littoral basin on sandy substra. Surrounding vegetation: Pinus forest, Alnus quercetum, Caricetum.","10.21233/gv9c-yr51"
3428,"Le Marais de la Perge (South)","SO6",45.3825,-1.115,2,4441,"pollen","European Pollen Database","Diot, M.F., and J.P. Tastet. 1995. Paleo-environnements Holocenes et limites chrono-climatiques enregistres dans un marais estuarien de la Gironde (France). Quaternaire 6(2):63-75.","Marsh. Physiography: atlantic coast. Surrounding vegetation: Pinus forest.","10.21233/8ph7-sh90"
3429,"Sögüt Gölü","SOGUT",36.9975,29.898333,1400,4442,"pollen","European Pollen Database","Van Zeist, W., H. Woldring, and D. Stapert. 1975. Late Quaternary vegetation and climate of southwestern Turkey. Palaeohistoria 17:53-144.","Drained lake. Physiography: intramontane depression. Surrounding vegetation: Scattered Juniperus (actual).","10.21233/epfd-de13"
3430,"Solnechnoe","SOLNECH",65.833333,34.333333,10,4443,"pollen","European Pollen Database","Elina, G.A. 1981. Printsipy i metody rekonstruktsii i kartirovaniya rastitelonosti golotsena [Principles and methods for reconstruction and mapping of Holocene vegetation]. Nauka, Leningrad, Russia. Notes: 159 pp.","Mire. Surrounding vegetation: Pinus.","10.21233/bp9d-qh60"
3432,"Lake Solsø","SOLSOE81",56.12846,8.61341,41,4445,"pollen","European Pollen Database","Odgaard, B.V. 1988. Heathland history in western Jutland, Denmark. Pages 311-319 in H.H. Birks, H.J.B. Birks, P.E. Kaland, and D. Moe, editors. The Cultural landscape - Past, Present and Future. Cambridge, United Kingdom.;
Odgaard, B.V. 1992. The fire history of Danish heathland areas as reflected by pollen and charred particles in lake sediments. The Holocene 2:218-226. [DOI: 10.1177/095968369200200303];
Odgaard, B.V. 1994. The Holocene vegetation history of northern West Jutland, Denmark. Opera botanica 123:1-171.","Strongly drained lake, now mostly fen. Physiography: almost flat landscape, 30-90 asl heights. Surrounding vegetation: dry-moist pasture, fertilized.","10.21233/4r4q-0m97"
3432,"Lake Solsø","SOLSOE83",56.12846,8.61341,41,4446,"pollen","European Pollen Database","Odgaard, B.V. 1988. Heathland history in western Jutland, Denmark. Pages 311-319 in H.H. Birks, H.J.B. Birks, P.E. Kaland, and D. Moe, editors. The Cultural landscape - Past, Present and Future. Cambridge, United Kingdom.;
Odgaard, B.V. 1994. The Holocene vegetation history of northern West Jutland, Denmark. Opera botanica 123:1-171.","Strongly drained lake, now mostly fen. Physiography: almost flat landscape, 30-90 asl heights. Surrounding vegetation: dry-moist pasture, fertilized.","10.21233/mtmk-d772"
3434,"Mire Sosvyatskoe","SOSVIATS",56.2,32,175,4448,"pollen","European Pollen Database","Gunova, V.S., and A.R. Sirin. 1995. Paleogeographical condition of bog development in Zapadnodvinskaya lowland during Holocene. Pages 27-36 in Palynology in the Russia, Part 2. Moscow, Russia.","Mire. Physiography: depression of late Pleistocene glacial. Surrounding vegetation: pine forest with small shrubs + Sphagnum.","10.21233/ash6-pn98"
3435,"Spjällsjön","SPAJALLS",56.68361,14.59256,146,4449,"pollen","European Pollen Database","Björck, S., and P. Möller. 1987. Late Weichselian environmental history in southeastern Sweden during the deglaciation of the Scandinavian ice sheet. Quaternary Research 28:1-37. [DOI: https://doi.org/10.1016/0033-5894(87)90030-5]","Very big lake. Physiography: in a drumlin-reed area. Surrounding vegetation: mainly spruce with some birch.","10.21233/fwvv-4v86"
3436,"Menez-Cam","SPEZET",48.25,-3.5,133,4450,"pollen","European Pollen Database","van Zeist, W. 1963. Recherches palynologiques en Bretagne Occidentale. Congrès Préhistorique de France, Rennes, France. Notes: Number 37, pages:5-19;
van Zeist, W. 1964. A paleobotanical study of some bogs in western Brittany (Finistère), France. Paleohistoria 10:157-180.","Bog. Physiography: Montaneous area (Montagnes noires). Surrounding vegetation: cultivated fields.","10.21233/c7fs-kf76"
3439,"Lake Srebarna","SRE4",44.107145,27.07141,20,4453,"pollen","European Pollen Database","Lazarova, M. 1995. Human impact on the natural vegetation in the region of Lake Srebarna and mire Garvan (northeastern Bulgaria). Palynological and Palaeoethnobotanical evidence. Pages 47-67 in E. Bozilova and S. Tonkov, editors. Advances in Holocene Palaeoecology in Bulgaria. Pensoft Publication, Sofia-Moscow.","Lake-Biosphere reserve. Physiography: on the terrace of Danube river. Surrounding vegetation: quercetum mixtum groups and agriculture.","10.21233/xh4t-jz66"
3439,"Lake Srebarna","SREBAR",44.107145,27.07141,20,4454,"pollen","European Pollen Database","Bozilova, E.D., M.A. Lazarova, and K. Strashevska. 1985. Geomorphological characteristics and development of the vegetation in the region of Srebarna Lake Bulgaria (in Bulgarian). Godishnik na Sofiiskiya Universitet ""Kliment Okhridski"" Biologicheski Fakultet 79(2):99-109.","Lake-Biosphere reserve. Physiography: on the terrace of Danube river. Surrounding vegetation: quercetum mixtum groups and agriculture.","10.21233/dt5f-d083"
3441,"Steklin","STEKLIN",52.93682,18.98338,73,4457,"pollen","European Pollen Database","Noryskiewicz, B. 1982. Lake Steklin - A reference site for the Dobrzyn-Chelmno Lake District, northern Poland: Report on palaeoecological studies for the IGCP Project Number 158B. Acta Palaeobotanica 22(1):65-83.;
Noryskiewicz, B., and M. Ralska-Jasiewiczowa. 1989. Type Region P-w: Dobrzyn-Olsztyn Lake Districts. Acta Palaeobotanica 29(2):85-93.","Lake basin with steep slopes. Physiography: part of subglacial channel. Surrounding vegetation: anthropogenic communities.","10.21233/3kq6-mf19"
3444,"Saint Sauveur","STSAU",43.566389,3.916667,1,4460,"pollen","European Pollen Database","Puertas, O. 1997. Evolution de la végétation depuis le Dryas récent dans la plaine littorale de Montpellier (Hérault, France) à partir de l'analyse pollinique. Dynamique naturelle et anthropisation du milieu. Doctoral dissertation. Université de Franche-Comté, Besançon, France.","Lagoon. Physiography: coastal. Surrounding vegetation: Quercus ilex-Ericaceae-Cistaceae.","10.21233/fkx0-0r79"
3445,"Saint-Thomas","STTHOMAS",47.268611,-1.75,56,4461,"pollen","European Pollen Database","Voeltzel, D. 1987. Recherches pollenanalytiques sur la vegetation holocene de la plaine alluviale de l'estuaire de la Loire et des coteaux environnants. Doctoral dissertation. Université d'Aix-Marseille, Marseille, France.","Peaty meadow. Physiography: depression in valley. Surrounding vegetation: fields and shrubs.","10.21233/gy1d-0c88"
3446,"Stupino","STUPINO",52.25,39.833333,95,4462,"pollen","European Pollen Database","Neustadt, M.I. 1957. History of Usman pine forest over the late Holocene [in Russian]. Voron. Reserv. Proc. 5:168-173.;
Surova, T.G., and A.N. Krenke. 1992. On the vegetation development and climate changes of Voronezh area during the Holocene [in Russian]. Data of meteorological studies 15:100-110. Russian Academy of Sciences Geophysical Committee.","Mire. Physiography: pading. Surrounding vegetation: pine, oak.","10.21233/9yk4-5092"
3447,"Saint Viaud Cantin","STVIAUD",47.265,-2.016667,2,4463,"pollen","European Pollen Database","Bernard, J. 1996. Paléoenvironnement du Pays de Retz et du marais breton-vendéen. Doctoral dissertation. Université de Nantes, Nantes, France. Notes: vol. I, texte: 190p., vol. II, illustrations: 55p.","Marsh. Physiography: Loire valley. Surrounding vegetation: marsh and cultivated fields.","10.21233/9jtj-a557"
3449,"Sudoble Lake","SUDOBLE",54.033333,28.1,165,4466,"pollen","European Pollen Database","Bogdel, I.I. 1984. Razvitie prirody Belorrussii v golotsene [Holocane environmental changes of Byelorussia]. Doctoral dissertation. Belarusskii Universety, Minsk, Belarus. Notes: 192 pages;
Elovicheva, Y.K., and I.I. Bogdel. 1985. Novye razrezy golosena Belarusi [New Holocene sections of Byelorussia]. Pages 141-169 in Geologicheskoe stroenie osadochnoi tolshchi Belorussii [Geological composition of sedimentary sequence of Byelorussia], Nauka i Tekhnika edition. Minsk, Byelorussia.","Kettle lake. Physiography: Fluvio-glacial flat. Surrounding vegetation: Pine, birch,oak.","10.21233/wwj8-s239"
3450,"Suho ezero II","SUH2",42.0651658,23.5600111,1900,4467,"pollen","European Pollen Database","Bozilova, E., and A.G. Smith. 1979. Palynology of lake Sucho Ezero from South Rila Mountain (Bulgaria). Phytologia 11:54-67.;
Bozilova, E.D.B., S. Tonkov, and D. Pavlova. 1986. Pollen and plant macrofossil analyses of the Lake Sucho Ezero in the south Rila mountains. Annual of Sofia University, Faculty of Biology 80(2):48-57.","Peat bog on the place of former lake. Surrounding vegetation: Pinus silvestris, Pinus peuce, Picea, Abies.","10.21233/k4zb-ze21"
3451,"Suovalampi","SUOVAL",69.603,28.83694,104,4468,"pollen","European Pollen Database","Hyvärinen, H. 1975. Absolute and relative pollen diagrams from northernmost Fennoscandia. Fennia 142(1):1-23.","Lake. Physiography: hummocky, bouldery ablation moraine. Surrounding vegetation: thin birch and pine woodland.","10.21233/vhxz-9969"
3452,"Svatobořice-Mistřín","SVATOBOR",48.94393,17.069345,174,4469,"pollen","European Pollen Database","Svobodová, H. 1989. Rekonstrukce přírodního prostředí a osídlení v okolí Mistřína. Palynologická studie. Památky archeologické 80:188-206.","Peat bog. Surrounding vegetation: quercetea robori-petraeae.","10.21233/6yzy-mc78"
3453,"Svencele Bog","SVENC",55.495278,21.292222,7,4470,"pollen","European Pollen Database","","Peat-bog. Physiography: on the maritime terrace. Surrounding vegetation: Betula, Alnus, Populus, Salix.","10.21233/qfrx-zf42"
3455,"Syrjälänsuo","SYRJALAN",61.216667,28.116667,83,4472,"pollen","European Pollen Database","","Restricted peat bog. Physiography: Suppasuo in connection with sandy harjut (esker). Surrounding vegetation: Pinus, tall dwarf shrubs.","10.21233/26e5-b250"
3456,"Szymbark","SZYM_N",49.633333,21.1,465,4473,"pollen","European Pollen Database","Gil, E., E. Gilot, A. Kotarba, L. Starkel, and K. Szczepanek. 1974. An early Holocene landslide in the Niski Beskid and its significance for palaeogeographical reconstructions. Studia Geomorphologica Carpatho-Balcanica 8:69-83.;
Szczepanek, K. 1989. Type region P-c: Low Beskidy Mountains. Acta Palaeobotanica 29(2):17-23.","Mesotrophic peat-bog. Physiography: landslide nich. Surrounding vegetation: fir-Beech forests.","10.21233/h75a-p298"
3458,"Tarnawa Wyżna","TAR2_N",49.111435,22.827280000000002,670,4476,"pollen","European Pollen Database","Ralska-Jasiewiczowa, M. 1989. Type region P-e: The Bieszczady Mountains. Acta Palaeobotanica 29(2):31-35.","Raised bog. Physiography: upper terrace of San (uppermost course). Surrounding vegetation: meadows, fen, spruce (spruce-fir) stands.","10.21233/wbfp-6424"
3460,"Tarnowiec","TARW_N",49.73807,21.56259,220,4479,"pollen","European Pollen Database","Harmata, K. 1987. Late-Glacial and Holocene history of vegetation at Roztoki and Tarnowiec near Jasło (Jasło-Sa­nok Depression). Acta Palaeobotanica 27(1):43-65.","Depression with lacustrine chalk and peat. Physiography: thermokarst hollow between small hills. Surrounding vegetation: fields and meadows.","10.21233/b3av-3w75"
3461,"Tatli Gölü","TATLI",41.566667,36.066667,0,4480,"pollen","European Pollen Database","Bottema, S., H. Woldring, and B. Aytuğ. 1993. Late Quaternary vegetation history of northern Turkey. Palaeohistoria 35/36:13-72. http://rjh.ub.rug.nl/Palaeohistoria/article/view/25071.","Lake. Physiography: flat coastal. Surrounding vegetation: marsh, agriculture, grazing.","10.21233/4wtd-sv24"
3462,"Teguldet","TEGULD",57.333333,88.166667,150,4481,"pollen","European Pollen Database","Blyakharchuk, T.A. 1989. Istorija rastitel'nosti yugovostoka Zapadnoi Sibiri v golotsene po dannym botanicheskogo i sporovo-pyl'tsevogo analiza torfa [The Holocene history of vegetation of south-eastern West Siberia by botanical and pollen analyses of peat deposits]. Doctoral dissertation. Tomsk State University, Tomsk, Russia.","Mesotrophic bog. Physiography: ancient valley of Chulym River. Surrounding vegetation: Betula pendula, Pinus sylvestris, Pinus sibirica, Abies s.","10.21233/nq7x-mx79"
3463,"Tenaghi Philippon","TENAGI1",40.96361,24.262765,10,4482,"pollen","European Pollen Database","Turner, J., and J.R.A. Greig. 1975. Some Holocene pollen diagrams from Greece. Review of Palaeobotany and Palynology 20:171-204.","Tectonic depression. Surrounding vegetation: Populus and planted Acacias.","10.21233/d47b-gd35"
3464,"Delta del Rio Besos","TG8",41.4052777777778,2.248333,0,4483,"pollen","European Pollen Database","Pantaléon-Cano, J., R.P. Pérez-Obiol, and J.M. Roure. 1994. La representacion del paisaje vegetal del area de Barcelona durante en ultimo milenio a partir del analisis polinico de sedimentos marinos del delta del rio Besos datados por 210Pb. Pages 211-223 in I. Mateu, M. Dupré, J. Guemes, and M.E. Burgaz, editors. Trabajos de palinologia basica y aplicada, Universitat de València edition. València, Spain.","Estuarine .Physiography:  Delta of a river Besós. Surrounding vegetation: Quercus.","10.21233/qp8c-4854"
3465,"Thorpe Bulmer","THORPE",54.71194,-1.2988,100,4484,"pollen","European Pollen Database","Bartley, D.D., and A.V. Morgan. 1990. The palynological record of the King's Pool, Stafford, England. New Phytologist 116(1):177-194. https://nph.onlinelibrary.wiley.com/doi/abs/10.1111/j.1469-8137.1990.tb00522.x. [DOI: 10.1111/j.1469-8137.1990.tb00522.x];
Bartley, D.D., C. Chambers, and B. Hart-Jones. 1976. The vegetational history of parts of south and east Durham. New Phytologist 77:437-468. https://nph.onlinelibrary.wiley.com/doi/abs/10.1111/j.1469-8137.1976.tb01533.x. [DOI: 10.1111/j.1469-8137.1976.tb01533.x]","Sphagnum dominates this peat infill. Physiography: Infilled kettle hole. Surrounding vegetation: Arable fields and conifer plantation.","10.21233/4b53-ep44"
3466,"Tschokljovo Marsh","TM1",42.366667,22.833333,870,4485,"pollen","European Pollen Database","Bozilova, E., and S. Tonkov. 1985. Vegetational development in the mountainous areas of SW Bulgaria. I. Palynological investigation and reconstruction of past vegetation. Ecologia Mediterranea 11(1):33-37.;
Chakalova, E., D. Stojanova, and S. Tonkov. 1990. Plant macrofossil remains from the Chokljovo Marsh (Konjavska Mountains). (In Bulgarian) Annual of Sofia University, Faculty of Biology 80(2):41-47..;
Tonkov, S., and E. Bozilova. 1992. Paleoecological investigation of Tchokljovo Marsh (Konjavska Mountains). Annual of Sofia University, Faculty of Biology 83(2):5-16..","Lake. Surrounding vegetation: meadows and arable land and oak forest.","10.21233/h5wh-mm89"
3468,"Lake Balaton (Centre)","TO-30",46.744444,17.400833,104,4487,"pollen","European Pollen Database","Nagy-Bodor, E., T. Cserny, and E. Nagy. 1995. Unpublished report on the study performed for the European Pollen Database..","Lake. Surrounding vegetation: forest dominance of Quercus Fagus.","10.21233/wn8a-n079"
3470,"Åkerhultagöl [Tomtabaken]","TOMTABAC",57.483333,14.466667,303,4489,"pollen","European Pollen Database","Bjelm, L. 1976. Deglaciation of the Smalard Highland, with special reference to deglaciation, ice thickness and chronology. Lundqua Theses 2:1-78.","A mire pool. Physiography: basin sourrounded by hills. Surrounding vegetation: forests with pine and spruce.","10.21233/5ry3-kt92"
3471,"Tondi","TONDII",59.43194,24.89246,40,4490,"pollen","European Pollen Database","Kimmel, K., R. Rajamäe, and M. Sakson. 1996. The Holocene Development of Tondi Mire, Northern Estonia: Pollen, Diatom and Chronological Studies. Pages 85–102 in T. Hackens, S. Hicks, V. Lang, U. Miller, and L. Saarse, editors. Coastal Estonia. Recent advances in environmental and cultural history. PACT 51.;
Saarse, L., and A. Liiva. 1995. Geology of the Äntu group of lake. Proceedings Acad. Sci. Estonia, Geology 44:119–132.","Overgrown lake, raised bog. Physiography: alvar area, flat limestone plateau. Surrounding vegetation: not left any, in town!.","10.21233/rnkp-2723"
3472,"Toppeladugärd","TOPPELA",55.60223,13.36716,35,4491,"pollen","European Pollen Database","Liedberg Jönsson, B. 1988. The Late Weichselian macrofossil flora in western Skåne, southern Sweden. Doctoral dissertation. Lund University, Lund, Sweden. Notes: Lundqua Thesis 24, 1-42","Former fen appears as a damp hollow. Physiography: small hollow, formerly a kettle hole. Surrounding vegetation: intensive agriculture.","10.21233/ec5n-qe16"
3473,"Puerto de Los Tornos","TORNOS01",43.15,-3.433333,920,4492,"pollen","European Pollen Database","Penalba, M.C. 1989. Dynamique de vegetation Tardiglaciaire et Holocene du centre-nord de l'Espagne d'après l'analyse pollinique. Doctoral dissertation. Université d'Aix-Marseille, Marseille, France.","Peat-bog. Physiography: top of Puerto de Los Tornos. Surrounding vegetation: Fagus, Pteridium aquilinum, Ulex, Ericaeae.","10.21233/4r7r-4258"
3474,"Tourves","TOURVES",43.41312,5.91072,300,4493,"pollen","European Pollen Database","Nicol-Pichard, S. 1987. Analyse pollinique d'une séquence tardi et postglaciaire à Tourves (Var, France). Ecologia Mediterranea 13(1-2):29-42.","Peat-bog. Physiography: depression. Surrounding vegetation: cultivated fields and forest.","10.21233/jjat-b004"
3476,"Trumer Moos","TRUMER",47.944444,13.077778,500,4495,"pollen","European Pollen Database","Krisai, R. 1975. Die Ufervegetation der Trumer Seen (Salzburg). Dissertationes Botanicae 29:1-202.","Mire in partly in-filled lake. Physiography: lakes between glacial moraines. Surrounding vegetation: mire.","10.21233/vmrj-2x38"
3478,"Mire Johvika","TUIU",58.484798,22.388031,32,4497,"pollen","European Pollen Database","Hansson, A.M., S. Hiie, K. Kihno, R. Masauskaité, D. Moe, V. Seiriené, and N. Torske. 1996. A vegetation historical study of Johvikasoo, an ombrogenous mire at Tuiu, Saaremaa, Estonia. PACT 51:39-55.","Mire overgrown by Pinus. Physiography: basin dammed by Ancylus lake formations. Surrounding vegetation: mostly pine forest.","10.21233/zcst-x145"
3479,"Tullerinsuo","TULLERIN",61.3398,21.95107,29,4498,"pollen","European Pollen Database","Vuorela, I. 1991. Lounais-suomen varhaismetallikautinen asutus ja viljely siitepölyanalyysin valossa. Karhunhammas 13:2-23.","Raised bog. Physiography: Sphagnum peat. Surrounding vegetation: Pinus forest, Lednum palustre, Eriophorum.","10.21233/zx8x-vj28"
3482,"Grosses Überling Schattseit-Moor","UBERLING",47.172222,13.9,1750,41756,"pollen","European Pollen Database","Krisai, R., B. Burgstaller, U. Ehmer-Künkele, R. Schiffer, and E. Wurm. 1991. Die Moore des Ost-Lungaues - Heutige Vegetation, Enstehiung, Waldgeschichte ihrer Umgebung. Sauteria 5:1-240.","Almost untouched. Surrounding vegetation: Picea forest with Larix and Pinus cembra.","10.21233/0cwj-zt80"
3482,"Grosses Überling Schattseit-Moor","UBERLING",47.172222,13.9,1750,4501,"pollen","European Pollen Database","Krisai, R., B. Burgstaller, U. Ehmer-Künkele, R. Schiffer, and E. Wurm. 1991. Die Moore des Ost-Lungaues - Heutige Vegetation, Enstehiung, Waldgeschichte ihrer Umgebung. Sauteria 5:1-240.","Almost untouched. Surrounding vegetation: Picea forest with Larix and Pinus cembra.","10.21233/3jez-g489"
3483,"Uitbergen","UITBERG",51.017778,3.944722,4,4502,"pollen","European Pollen Database","Verbruggen, C. 1979. Paleoecologische en palynlogische benadering van enkele bekende historisch-geografisch problemen in Vlaaderen. Bronnen voor de historisch geografie van Belgie. Handelingen van het Colloquium te Brussel, 25-27-IV:487-497.","Fen. Physiography: depression of a coversand plain and . Surrounding vegetation: grassland and scattered trees.","10.21233/nvn7-f141"
3484,"Lake Urmia","URMIA20",37.583333,45.466667,1265,4504,"pollen","European Pollen Database","Bottema, S. 1986. A late Quaternary pollen diagram from Lake Urmia (northwestern Iran). Review of Paleobotany and Palynology 47:241-261.;
Bottema, S. 1987. Chronology and climatic phases in the near east from 16,000 to 10,000 BP. Pages 295-310 in O. Aurenche, J. Evin, and F. Hours, editors. Chronologies in the Near East: Relative Chronologies and Absolute Chronology, 16000-4000 B.C. British Archaeological Reports S379. BAR Publishing, Oxford, United Kingdom.;
Kelts, K.R., and M. Shahrabi. 1986. Holocene sedimentology of hypersaline lake Urmia, nortwestern Iran. Palaeogeography, Palaeoclimatology, Palaeoecology 54:105-130.;
Van Zeist, W., and S. Bottema. 1977. Palynological investigations in western Iran. Palaeohistoria 19:19-85.;
Wright, H.E., Jr., J.H. McAndrews, and W. van Zeist. 1967. Modern pollen rain in western Iran, and its relation to plant geography and Quaternary vegetational history. Journal of Ecology 55:415-443.","Saline lake. Physiography: basin in plateau. Surrounding vegetation: Artemisia fragratis and remnants of Quercetea brantii.","10.21233/pj9k-qg05"
3485,"Ust'Mashevskoe","USTMASH",56.316667,57.883333,220,4505,"pollen","European Pollen Database","Panova, N.K., V.I. Makovsky, and N.G. Erokhin. 1996. Golotsenovaya dinamika rastitelnosti v raione Krasnoufimskoi stepi [Holocene dynamics of vegetation in Krasnoufimskaya forest-steppe area]. Pages 80-93 in Lesoobrazovatel'nyi protses na Urale i Zaural'e [Forest Formation Processes in the Urals and Transural Region]. Intitute of forest, Ekaterinburg, Russia.","Raised bog of first terrace of Ufa river. Physiography: plateau. Surrounding vegetation: Picea obovata, Betula pubescens, Pinus.","10.21233/zkna-r256"
3492,"Vernéřovice","VERNER",50.60464,16.213235,450,4517,"pollen","European Pollen Database","Peichlová, M. 1979. Historie vegetace Broumovska [Vegetation history of the Broumovsko region]. Doctoral dissertation. Institute of Botany, Czechoslovak Academy of Science, Průhonice.;
Rybníčková, E., and K. Rybníček. 1996. Czech and Slovak Republics. Pages 474-505 in B. Berglund, editor. Palaeoecological Events During the Last 15000: Regional Syntheses of Palaeoecological Studies of Lakes and Mires in Europe. Wiley, Chichester.","Flat valley. Physiography: valley fen, slightly sloping. Surrounding vegetation: cultivated fields, meadow, spruce.","10.21233/s8kk-y022"
3493,"Vingölen","VINGOL",57.13371,15.93773,104,4518,"pollen","European Pollen Database","Svensson, N.O. 1989. Late Weichseian and early Holocene shore displacement in the central Baltic, based on stratigraphical and morphological records from eastern Smaland and Gotland, Sweden. Doctoral dissertation. Lund University, Lund, Sweden. Notes: Lundqua Thesis 25","A small lake. Physiography: in a sheltered position in a valley. Surrounding vegetation: mostly spruce.","10.21233/tkzz-2t77"
3494,"Vishnevskoe Lake","VISHN",60.502222,29.516944,15,4519,"pollen","European Pollen Database","Arslanov, K.A., N.N. Davydova, D.A. Subetto, and V.I. Khomutova. 1992. Karelian Isthmus [in Russian]. Pages 64-77 in Istoria ozer Vostochno-Evropeiskoi ravniny [The lake history of East-European Plain]. St. Petersburg, Russia.;
Davydova, N.N., D.A. Subetto, and V.I. Khomutova. 1991. Paleolimnology of Vishnevskoe and Michurinskoe Lakes (Karelian Isthmus) [in Russian]. Pages 195-198 in Antropogennye izmeneniya sistem malyh ozer [Antropological changes of small lake systems]. Gidrometizdat, St. Petersburg, Russia.;
Khomutova, V.I. 1989. Paleogeography and biostratigraphy of lake sediments from forest zone of European part of USSR by spore-pollen data [in Russian]. Specialization 11.00.04 - geomorphology and evolution geography. Doctoral dissertation. Leningrad, Russia.;
Tarasov, P.E., S.P. Harrison, L. Saarse, M.Y. Pushenko, A.A. Andreev, Z.V. Aleshinskaya, N.N. Davydova, N.I. Dorofeyuk, Y.V. Efremov, V.I. Khomutova, D.V. Sevastyanov, J. Tamosaitis, O.N. Uspenskaya, O.F. Yakushko, and I.V. Tarasova. 1994. Lake status records from the former Soviet Union and Mongolia: data base documentation. Paleoclimatology Publications Series 2, World Data Center-A for Paleoclimatology, NOAA Paleoclimatology Program, Boulder, Colorado, USA. Notes: https://books.google.no/books?id=SXeZJsjZ4dwC&printsec=frontcover&source=gbs_ge_summary_r&cad=0#v=onepage&q=melekhovo&f=false;
Trifonova, I., and N. Davydova. 1983. Diatoms in the plankton and sediments of two lakes of different trophic type [in Russian]. Hidrobiologia 103:265-268..","Small, shallow flat bottomed lake. Physiography: glacial and limno-glacial sediments. Surrounding vegetation: pine-birch forest.","10.21233/tf7h-ns76"
3494,"Vishnevskoe Lake","VISHNEVS",60.502222,29.516944,15,46514,"pollen","European Pollen Database","Arslanov, K.A., L.A. Savelieva, N. Gey, V.A. Klimanov, S.B. Chernov, G.M. Chernova, G.F. Kuzmin, T.V. Tertychnaya, D.A. Subetto, and V.P. Denisenkov. 1999. Chronology of vegetation and paleoclimatic stages of North-Western during the Late Glacial and Holocene. Radiocarbon 41(1):25-45. [DOI: https://doi.org/10.1017/S0033822200019317]","Small, shallow flat bottomed lake. Physiography: glacial and limno-glacial sediments. Surrounding vegetation: pine-birch forest.","10.21233/7M90-YN39"
3497,"Velké Němčice","VNEMCICE",48.98183,16.66396,177,4522,"pollen","European Pollen Database","Svobodová, H. 1990. Vegetace Jižní Moravy v druhé polovině prvého tisíciletí. Archeologické rozhledy 42:170-205.","Svratka river bank. Surrounding vegetation: carpinion.","10.21233/47e3-xh50"
